{
  "schema_version": 1,
  "description": "Bilingual vocabulary for scripts/route_task.py. Priority, word boundaries, and combination logic stay in Python; this file owns only the phrases. Validate with python3 scripts/validate_prompt_catalog.py.",
  "defaults": {
    "domain": "general",
    "deliverable": "analysis",
    "lifecycle": "create"
  },
  "axes": {
    "domain": {
      "software": [
        "code",
        "bug",
        "debug",
        "api",
        "website",
        "web app",
        "script",
        "software",
        "automation",
        "configuration",
        "router",
        "prompt",
        "ci",
        "github actions",
        "json schema",
        "installer",
        "powershell",
        "wrapper",
        "โปรแกรม",
        "โค้ด",
        "เว็บ",
        "ระบบอัตโนมัติ"
      ],
      "research": [
        "research",
        "paper",
        "manuscript",
        "thesis",
        "literature",
        "experiment",
        "วิจัย",
        "บทความ",
        "วิทยานิพนธ์",
        "หลักฐาน"
      ],
      "book-writing": [
        "book",
        "textbook",
        "book writing",
        "write a book",
        "write the book",
        "ตำรา",
        "เขียนหนังสือ",
        "เขียนตำรา",
        "ต้นฉบับหนังสือ",
        "ต้นฉบับตำรา"
      ],
      "education": [
        "course",
        "lesson",
        "syllabus",
        "student",
        "teaching",
        "rubric",
        "curriculum",
        "workshop",
        "seminar",
        "หลักสูตร",
        "บทเรียน",
        "รายวิชา",
        "เอกสารคำสอน",
        "สอน",
        "สัมมนา",
        "แบบฝึก",
        "กิจกรรมการเรียน"
      ],
      "governance": [
        "policy",
        "governance",
        "council",
        "regulation",
        "standard",
        "master plan",
        "institutional transformation",
        "ipst",
        "ioi",
        "นโยบาย",
        "สภามหาวิทยาลัย",
        "ข้อบังคับ",
        "สสวท",
        "มาตรฐาน",
        "แผนแม่บท"
      ],
      "operations": [
        "deadline",
        "submit",
        "submission",
        "compliance",
        "dossier",
        "correspondence",
        "coordination",
        "follow up",
        "nomination",
        "application",
        "academic promotion",
        "academic-rank",
        "KU forms",
        "meeting follow-up",
        "กำหนดส่ง",
        "ยื่น",
        "เอกสารราชการ",
        "ติดตาม",
        "ประสานงาน",
        "เสนอชื่อ",
        "ใบสมัคร",
        "สมัครงาน",
        "สมัครเรียน",
        "แฟ้ม",
        "ตำแหน่งวิชาการ",
        "ศาสตราจารย์"
      ]
    },
    "deliverable": {
      "code": [
        "code",
        "implement",
        "fix",
        "debug",
        "refactor",
        "build app",
        "โค้ด",
        "แก้บั๊ก",
        "รีแฟกเตอร์",
        "พัฒนาโปรแกรม"
      ],
      "analysis": [
        "analysis",
        "analyze",
        "finding",
        "วิเคราะห์",
        "ผลวิเคราะห์"
      ],
      "paper": [
        "paper",
        "manuscript",
        "article",
        "preprint",
        "submission draft",
        "thesis",
        "dissertation",
        "defense draft",
        "ดุษฎีนิพนธ์",
        "ปริญญานิพนธ์",
        "สารนิพนธ์",
        "reviewer",
        "reviewers",
        "reviewer response",
        "rebuttal letter",
        "author response",
        "ตอบ reviewer",
        "ตอบรีวิวเวอร์",
        "ตอบผู้ทรงคุณวุฒิ",
        "ตอบผู้ประเมิน",
        "ตอบข้อคิดเห็นผู้ประเมิน",
        "จดหมายตอบผู้ประเมิน",
        "บทความ",
        "ต้นฉบับบทความ",
        "ร่างบทความ",
        "วิทยานิพนธ์",
        "ผู้ทรงคุณวุฒิ"
      ],
      "book": [
        "book",
        "textbook",
        "book writing",
        "write a book",
        "write the book",
        "ตำรา",
        "เขียนหนังสือ",
        "เขียนตำรา",
        "ต้นฉบับหนังสือ",
        "ต้นฉบับตำรา"
      ],
      "policy": [
        "policy",
        "regulation",
        "proposal to council",
        "master plan",
        "นโยบาย",
        "ข้อบังคับ",
        "เสนอสภา",
        "แผนแม่บท"
      ],
      "presentation": [
        "slide",
        "slides",
        "presentation",
        "deck",
        "talk",
        "seminar",
        "briefing",
        "สไลด์",
        "นำเสนอ",
        "บรรยาย",
        "สัมมนา"
      ],
      "course-material": [
        "course",
        "lesson",
        "syllabus",
        "exercise",
        "rubric",
        "course material",
        "teaching document",
        "workshop",
        "บทเรียน",
        "ประมวลรายวิชา",
        "รายวิชา",
        "แบบฝึก",
        "เอกสารสอน",
        "เอกสารคำสอน",
        "กิจกรรมการเรียน"
      ],
      "document": [
        "document",
        "documents",
        "form",
        "forms",
        "letter",
        "report",
        "dossier",
        "correspondence",
        "nomination",
        "เอกสาร",
        "แบบฟอร์ม",
        "หนังสือ",
        "รายงาน",
        "จดหมาย",
        "แฟ้ม",
        "เสนอชื่อ"
      ],
      "decision": [
        "recommend",
        "strategy",
        "choose",
        "decision",
        "แนะนำ",
        "กลยุทธ์",
        "ตัดสินใจ",
        "เลือก"
      ]
    },
    "method": {
      "content-analysis": [
        "content analysis",
        "codebook",
        "corpus",
        "thematic",
        "วิเคราะห์เนื้อหา",
        "กรอบรหัส"
      ],
      "data-analytics": [
        "data",
        "metric",
        "dashboard",
        "statistics",
        "chart",
        "ข้อมูล",
        "ตัวชี้วัด",
        "สถิติ",
        "กราฟ",
        "survey",
        "ผลสำรวจ",
        "แบบสอบถาม"
      ],
      "web-development": [
        "website",
        "web app",
        "frontend",
        "backend",
        "responsive",
        "accessibility",
        "เว็บไซต์",
        "เว็บแอป"
      ],
      "research-synthesis": [
        "literature",
        "evidence synthesis",
        "sources",
        "review papers",
        "ทบทวนวรรณกรรม",
        "สังเคราะห์หลักฐาน"
      ],
      "strategy-advisory": [
        "strategy",
        "options",
        "recommend",
        "recommendation",
        "recommendations",
        "advise",
        "advisory",
        "กลยุทธ์",
        "ทางเลือก",
        "คำแนะนำ"
      ]
    },
    "lifecycle": {
      "bootstrap": [
        "bootstrap",
        "new project",
        "เริ่มโปรเจกต์",
        "ตั้งโปรเจกต์"
      ],
      "resume": [
        "resume",
        "status",
        "ค้างตรงไหน",
        "ทำต่อ",
        "สถานะ"
      ],
      "review": [
        "review",
        "critique",
        "audit",
        "ตรวจ",
        "วิจารณ์",
        "ประเมิน"
      ],
      "publish": [
        "publish",
        "release the app",
        "release the software",
        "submit",
        "deploy",
        "เผยแพร่",
        "ส่งงาน",
        "ขึ้นระบบ"
      ],
      "monitor": [
        "monitor",
        "track",
        "watch",
        "ติดตาม",
        "เฝ้าดู"
      ],
      "implement": [
        "implement",
        "code",
        "fix",
        "refactor",
        "build",
        "แก้บั๊ก",
        "รีแฟกเตอร์",
        "พัฒนาซอฟต์แวร์"
      ]
    }
  },
  "strong_domains": [
    {
      "id": "software",
      "phrases": [
        "fix the",
        "implement",
        "refactor",
        "software project",
        "software package",
        "task router",
        "แก้บั๊ก",
        "พัฒนาซอฟต์แวร์"
      ]
    },
    {
      "id": "operations",
      "phrases": [
        "compliance tracking",
        "organize and preserve correspondence",
        "nomination dossier",
        "academic promotion",
        "academic-rank",
        "KU forms",
        "check the deadline",
        "official letter",
        "ติดตามกำหนด",
        "แฟ้มเสนอชื่อ",
        "หนังสือราชการ",
        "หนังสือภายนอก",
        "หนังสือภายใน",
        "ตำแหน่งวิชาการ",
        "ศาสตราจารย์"
      ]
    },
    {
      "id": "research",
      "phrases": [
        "write the paper",
        "write a paper",
        "revise the paper",
        "research manuscript",
        "เขียนบทความ",
        "แก้บทความ"
      ]
    },
    {
      "id": "education",
      "phrases": [
        "prepare the lesson",
        "prepare the course",
        "teaching document",
        "course workspace",
        "seminar",
        "เตรียมการสอน",
        "เอกสารคำสอน",
        "พัฒนาการสอน",
        "สัมมนา"
      ]
    },
    {
      "id": "book-writing",
      "phrases": [
        "write a book",
        "write the book",
        "book writing",
        "textbook",
        "build the book",
        "export the book",
        "เขียนหนังสือ",
        "เขียนตำรา",
        "ต้นฉบับหนังสือ",
        "ต้นฉบับตำรา",
        "build หนังสือ",
        "export หนังสือ",
        "จัดรูปเล่มหนังสือ",
        "ผลิตหนังสือ"
      ]
    },
    {
      "id": "governance",
      "phrases": [
        "policy proposal",
        "master plan",
        "university council",
        "institutional transformation",
        "IOI / POSN",
        "แผนแม่บท",
        "เสนอสภา"
      ]
    }
  ],
  "strong_outputs": [
    {
      "id": "code",
      "phrases": [
        "implement",
        "fix the",
        "debug",
        "refactor",
        "code change",
        "task router",
        "แก้บั๊ก",
        "รีแฟกเตอร์",
        "พัฒนาซอฟต์แวร์"
      ]
    },
    {
      "id": "document",
      "phrases": [
        "prepare the document",
        "submission document",
        "selection documents",
        "nomination dossier",
        "correspondence",
        "formal letter",
        "official letter",
        "จัดทำเอกสาร",
        "แฟ้มเสนอชื่อ",
        "หนังสือราชการ",
        "หนังสือภายนอก",
        "หนังสือภายใน",
        "จดหมาย"
      ]
    },
    {
      "id": "presentation",
      "phrases": [
        "prepare a presentation",
        "create slides",
        "slide deck",
        "slide decks",
        "create a deck",
        "สไลด์",